,id,title,description
31,0,Innovation Adoption Curve,"Definition: The innovation adoption curve classifies the entry of users into various categories, based on their willingness to accept new technology or an idea. It is useful in breaking down or segregating consumers into five different segments or categories such as innovators, early adopters, early majority, late majority, and laggards.Description: The innovation adoption curve follows a bell-shaped curve, which can be divided into five different categories. Let's discuss each one of them in detail. Usually, the innovators are the first ones to adopt the new idea or the technology. They consist of a small percentage of the population, almost 2.5 per cent. They are the ones who are young and willing to take risks about the new technology.	The next ones are early adopters. Early adopters consist of almost 13.5 per cent. One characteristic which differentiates this group from the others is that they have a high degree of leadership or influencing power. They are also young individuals who are willing to take that extra risk.	The third category of individuals who adopt an innovation is Early Majority (34%). The only difference is that here the time of adoption is slightly longer, but the percentage is higher than innovators and early adopters. They have an above-average social status, and accept change more quickly than the average.	The fourth category of is Late Majority (34%). The individuals in this category take a lot of time to adopt new technology. They are the ones who will do research because they are sceptical of innovation. They adopt the new technology because of peer pressure.	Laggards is the fifty category of individuals who adopt an innovation. They are reluctant to any change. By the time laggards adopt the new technology it might have already become obsolete. They are fixated on past methods or technology for their daily usage."
32,0,Intensive Distribution,"Definition: Intensive distribution is a form of marketing strategy under which a company tries to sell its product from a small vendor to a big store. Virtually, a customer will be able to find the product everywhere he goes. Soft drinks and cigarettes are some of the examples on which intensive distribution is followed.Description: Under the intensive distribution strategy, all the possible outlets can be used by a company to distribute the product. It creates brand awareness of the product as well as boost sales. This method is particularly useful for products like soft drinks, cigarettes etc. There are various advantages of intensive distribution. First, it increases the supply of the product which raises the chances of more sales. More sales mean more revenues for the company. Another advantage is that a company is able to analyse the source of sale, whether a product is more in demand from local vendors or hypermarket type stores. With this data, the company can further plan out its promotional efforts to boost sales and increase the presence of the product. Looking at the data, a company can also analyse the causes of its failure in increasing its sales at some locations. In that case either it can cut down on the distribution or increase marketing efforts to build brand awareness."
33,0,Introduction Stage,"Definition: Introduction stage is the first stage in the product life cycle. The highlighting factor of this stage is that the product is new in the market, sales are slow and to push it higher the company has to incur heavy expenditure on advertisement to make it appealing to customers.Description: The introduction stage is the first stage in the product life cycle where a company tries to build awareness about the product or service in a market where there is less or no competition. Once the company makes adequate publicity about the product either by promotion or through branding, it can look at other aspects such as pricing, as well as distribution. Pricing a product in the introduction stage is very important to gain market share. A popular pricing strategy followed by most of the companies is the skimming price strategy. In this pricing strategy, a company usually charges a very high price to customers, who are willing to purchase a product. Price skimming is common especially when mobile phones are launched with new and improved features. Companies with established brand names make sure that the new product has some features which stand unique and the owner takes a pride in owning that mobile phone. Few examples of unique features are: mobile charging, finger print scanner to unlock a phone, etc. Even flash sales that companies adopt for launching a product have high prices. For example, when Google launched its Nexus series 6, it launched this mobile through e-shopping platform with a price tag of Rs 44,000. The phone had the state-of-the-art specs which supported the high price tag."
34,0,Involvement,"Definition: Involvement or employee involvement can be defined as creating an environment in which an employee participates more in the day-to-day decision-making which leads to a better relationship with the manager. More direct participation by employees helps the organization to achieve its goals rapidly and effortlessly.Description: Employee involvement is not any quantitative tool or a goal of an organisation, it is more of a leadership tool or a thought which usually percolates from the top. This culture can only be adopted if senior managers are satisfied with more employees' participation in the day-to-day working of the company. For effective working, organisations should involve more and more people in some kind of decision-making or planning of activities. More involvement brings a sense of accomplishment in the minds of employees as well as increase their commitment level towards the organisation. The idea behind this concept is that employees who are already aligned with a set of work know what is best for the process or department they are working for. By engaging employees more, a firm shows that it values its employees, in turn it leads to a better commitment level from employees. Involving employees more would also lead to the dissemination of better ideas, which will result in higher productivity and better quality."
35,0,Lifestyle Segmentation,"Definition: Customer lifestyle segmentation is a practice which involves dividing the information of each and every customer into small sub-groups. These sub-groups are made from the data pertaining to each and every customer. These groups are created to draw inferences about customer choices, likes or dislikes.Definition: Customer lifestyle segmentation is a part of marketing management technique in which small sub-groups are created from the data according to their choices, needs, likes and dislikes. This data can actually help the company in pitching across different similar products to the customers in an effort to increase the market share. When a company or a brand team approaches a customer who is already using a similar product, s/he is more likely to buy a product if it is pitched properly. This can only happen if the company knows what the customer was using previously. 	Customer lifestyle segmentation data can help the marketing team to understand the customer properly in terms of his needs, choices as well as his taste for new products. Some customers are reluctant to change their product preference category, while few are more eager to buy a new product if introduced within a similar price range. The ones who are more flexible in buying new products are prospective buyers of the product or services, which the company is planning to make a pitch for, to the new customers."
36,0,Loss Leaders,"Definition: Loss leaders are high volume, high profile brands or products that are sold by retailers with the intention to attract customers into their premises, with the hope that those customers will end up buying other goods as well, once inside. Examples could be steeply discounted electronics, or consumer goods, or garments. A zero percent loan for cars is a loss leader example for the dealer. Description: Loss leader brands or products are sold at very slim margins or at a loss, with the conscious understanding that other products in the retail outlet will make up for the loss. A mix of loss leader pricing and usual pricing could make up the overall margins. Loss leaders can be used by smaller retailers against the giant national chains to maintain their market share. It can also be used as a price segmentation tool. "
37,0,Market Challenger,"Definition: A market challenger is a company which tries to expand its market share by aggressively flooding the market with its products at competitive prices. A market challenger is a firm or a company which is usually at the No.2 or No.3 position.Description: A market challenger is a firm which is just below the market leader with a good presence. The basic aim of the market challenger is to expand its market share and become the industry leader by introducing a new variety of products or by improving customer service etc. Companies with low market share usually try and adopt this strategy to increase their market share. They can challenge the market leader or other competitors by launching these strategies. When a brand enters a market, it is not necessary that the market leader is its competitor. Even companies which are at 2nd or the 4th position may turn out to be competiton as they may be eating into the market share.	How can a brand stop that?	1) Use of frontal attack	2) Flank Attack	3) Encirclement attack	4 Bypass attack and	5) Guerrilla marketing	A market challenger can deploy a full-frontal attack by introducing products similar to that of the market leader with similar quality, competitive pricing, aggressive advertisement and distribution process. The best strategy to gain market share is to introduce differentiated products which will help in creating their own brand name and push that product aggressively into the market with different distribution channels. Whatever strategy a firm adopts to gain market share or tries to bring down the market leader, requires a huge sum of money. To become a market challenger is a costly process and firms should be well aware of the same."
38,0,Market Concentration,"Definition: Market concentration is used when smaller firms account for large percentage of the total market. It measures the extent of domination of sales by one or more firms in a particular market. The market concentration ratio is measured by the concentration ratio.Description: The market concentration ratio measures the combined market share of all the top firms in the industry. ‘Market Share’ is used as a reference here in the formulae. It could be sales, employment statistics, number of people using a company’s services, number of outlets etc. The value of top firms or top ‘n’ firms may be three or maximum five. If the top firms keep on gaining market share, then we say that the industry has become highly concentrated. To understand market concentration, let’s first understand ‘concentration’. Concentration within an industry can be defined as the degree at which a small number of firms make up for the total production in the market. If the concentration is low, it simply means that top ‘n’ firms are not influencing the market production and the industry is considered to be highly competitive. On the other hand, if the concentration is high, it means that top ‘n’ firms influence the production or services provided in the market the industry then is said to be oligopolistic or monopolistic. 	The most common measure to calculate the market concentration is the Herfindahl-Hirschman Index (HHI). This index is calculated by adding the square root of the percentage market share of each individual firm in the industry. For example in a market consisting of only five firms with shares of 30%, 30%, 20%,20% and 20%, the Herfindahl Index would be 3000 (900 + 900+ 400+ 400+400). The index may rise as high as 10,000 if the market has a monopoly. But, lower the index is, more competitive the market becomes. The indicator could become zero for the perfect competition."
39,0,Market Development,"Definition: Market development is a strategic step taken by a company to develop the existing market rather than looking for a new market. The company looks for new buyers to pitch the product to a different segment of consumers in an effort to increase sales.Description: Market Development is a 2-step process to tap the untapped market. It begins with market research wherein a company does a segmentation analysis and short ists market segments which are worth pursuing. It is an attempt to use the existing product or service to attract new customers. The goal is to expand the reach or tap into a different segment or unexplored market. A segment is defined as the small sub-group of a larger population. For example, the marketing team of the company can divide the market based on geography, demographics as well as income levels etc. Once the company decides which segment to choose, the next step of market development involves creating a promotional strategy to enter into the market. For that, companies may have to take the support of both audio and visual media to push the product deeper into the market. 	Another aspect is the pricing of the product. If there are competitors in the market, you may have to price the product accordingly or come out with a product which belongs to the same segment but differs in features, quality etc. to command higher pricing. To counter competition, the marketing team could look at the penetration pricing where you can aggressively price the product below competitors product to gain market share. The major challenge faced by firms, which want to indulge in market development, is that it is a costly affair. It requires huge capital investment to keep the project going. If the investment in the new segment doesn’t pay off as desired, then the whole exercise turns out to be worthless."
40,0,Marketing Intelligence,"Definition: Marketing intelligence is the external data collected by a company about a specific market which it wishes to enter, to make decisions. It is the first set of data which the company analyses before making any investment decision.Description: Marketing intelligence is usually the first data set analysed by a company about a specific market. It could be related to population age in that area, infrastructure facilities, spending habits of consumers, state or government regulations etc. Marketing intelligence is all about gathering information on various data sets, analysing the information, breaking down the data into small subsets and the distribution of information to the relevant department of the company. 	A purchase department in a company would need a different data set under marketing intelligence, while a sales department would need something different. There are four main corner stones of marketing intelligence. The first one is competitor intelligence, the others are product intelligence, market understanding and customer understanding. Let’s understand each one of them in detail. Competitor intelligence is a legal method of obtaining information about products in a competitor’s portfolio. It is about analyzing strengths and weaknesses of the competitor. 	The basic goal of competitive intelligence is to make better business decisions. Product Intelligence is related to gathering information about your own product. The focus around product intelligence is on gathering information about the quality and performance of the product. This is usually an automated process. With the help of this knowledge, the company tries and makes the user experience better or makes changes in the product itself to make it safer or add new features. Market Understanding is a concept wherein the company tries to understand the performance of the product in which it is already operating as well as looks at other markets where it wants to launch its product thoroughly.	Finally, understanding the customer is the utmost important aspect in the life of any product. It is key to the success of the product pre- and post-sales."
41,0,Marketing Mix,"Definition: The marketing mix refers to the set of actions, or tactics, that a company uses to promote its brand or product in the market. The 4Ps make up a typical marketing mix - Price, Product, Promotion and Place. However, nowadays, the marketing mix increasingly includes several other Ps like Packaging, Positioning, People and even Politics as vital mix elements.Description: What are the 4Ps of marketing?Price: refers to the value that is put for a product. It depends on costs of production, segment targeted, ability of the market to pay, supply - demand and a host of other direct and indirect factors. There can be several types of pricing strategies, each tied in with an overall business plan. Pricing can also be used a demarcation, to differentiate and enhance the image of a product.Product: refers to the item actually being sold. The product must deliver a minimum level of performance; otherwise even the best work on the other elements of the marketing mix won't do any good.Place: refers to the point of sale. In every industry, catching the eye of the consumer and making it easy for her to buy it is the main aim of a good distribution or 'place' strategy. Retailers pay a premium for the right location. In fact, the mantra of a successful retail business is 'location, location, location'.Promotion: this refers to all the activities undertaken to make the product or service known to the user and trade. This can include advertising, word of mouth, press reports, incentives, commissions and awards to the trade. It can also include consumer schemes, direct marketing, contests and prizes.What is the importance of the marketing mix? All the elements of the marketing mix influence each other. They make up the business plan for a company and handled right, can give it great success. But handled wrong and the business could take years to recover. The marketing mix needs a lot of understanding, market research and consultation with several people, from users to trade to manufacturing and several others.How does Marketing Mix help your business? Watch video..."
42,0,Market Leader,"Definition: A market leader could be a product, brand, company, organisation, group name which has the highest percentage of total sales revenue of a particular market. Market leader dominates the market by influencing the customer loyalty towards it, distribution, pricing, etc.Description: Market leader can be attributed to a firm which has the largest market share in a given industry. The term could also be ascribed to a firm which has the highest profitability margin as well. The market share is calculated by dividing the volume of goods sold by a particular firm by the total number of units in the market. Market leadership as a concept holds much relevance in the internet age because over a period of time we have seen large number of companies becoming market leaders. 	Market leader often enjoys the first -mover advantage in new markets. Let’s look at some examples of market leaders in the digital space. Microsoft was the first company to launch operating system (Windows) and web browser (Internet Explorer) in the market. Apple as a company was the first one to introduce the concept of portable media device in which music can be stored on a drive, ipod. Market leadership is not about sales and dominance but it is more about how relevant the product is for the audience. Apple generates more revenue by selling iPods compared to other manufacturers who are selling MP3 players. It is all about innovative ideas which will help the company to connect with the relevant audience. The company tries to introduce those products in the market which can add value to the customer. Market leaders often unveil products which can redefine the customer experience in terms of product quality, longevity, ease of operating that product etc."
43,0,Markets,"Definition: A market is defined as the sum total of all the buyers and sellers in the area or region under consideration. The area may be the earth, or countries, regions, states, or cities.The value, cost and price of items traded are as per forces of supply and demand in a market. The market may be a physical entity, or may be virtual. It may be local or global, perfect and imperfect.Description: What are the different types of markets?A market can be called the 'available market' - that of all the people in the area. Within the available market, there is the 'market minimum'- or the market size, which will buy goods without any marketing effort. This is the lowest sale that a company could get without any action on its part. In today's world, this level is sinking ever lower.There is also the 'market potential', which is the maximum market size that will buy goods when subjected to the greatest marketing action that a company can do. Beyond this market potential, the costs outweigh the gains. The market potential is therefore the upper limit for a marketplace and sales."
44,0,Market Share,"Definition: Out of total purchases of a customer of a product or service, what percentage goes to a company defines its market share. In other words, if consumers as a whole buy 100 soaps, and 40 of which are from one company, that company holds 40% market share. Description: There are various types of market share. Market shares can be value or volume. Value market share is based on the total share of a company out of total segment sales. Volumes refer to the actual numbers of units that a company sells out of total units sold in the market. The value-volume market share equation is not usually linear: a unit may have high value and low numbers, which means that value market share may be high, but volumes share may be low. In industries like FMCG, where the products are low value, high volume and there are lots of freebies, comparing value market share is the norm.	The significance of market share: Market share is a measure of the consumers' preference for a product over other similar products. A higher market share usually means greater sales, lesser effort to sell more and a strong barrier to entry for other competitors. A higher market share also means that if the market expands, the leader gains more than the others. By the same token, a market leader - as defined by its market share - also has to expand the market, for its own growth. 	How much market share is enough? Usually, gaining 100% market share is not a good idea, as the risk associated with market actions, like fashion changes, product / use changes will impact the company heavily. Also, the cost and effort to maintain 100% market share against nimble, local or more aggressive smaller competitors can be very high and killing. Most companies decide on a target market share beyond which the cost of acquiring marketshare is more than the profit from that incremental gain."
45,0,Mark Up,"Definition: Mark up refers to the value that a player adds to the cost price of a product. The value added is called the mark-up. The mark-up added to the cost price usually equals retail price.For example, a FMCG company sells a bar of soap to the retailer at Rs 10. This is the cost price. The retailer adds Rs 2 as his value and sells the soap to the final consumer at Rs 10. The margin of Rs 2 between the cost price and MRP is the mark-up. In this case, the mark up on the cost price is (2/8= 25%) and on the MRP is 2/10 = 20%.Markup refers to the cost; margins to the price.Description: In the example, what is the significance of mark up? The amount of markup allowed to the retailer determines the money he makes from selling every unit of the product.Higher the markup, greater the cost to the consumer, and greater the money the retailer makes. In FMCG, typically, the MRP is low and the retailer is allowed a lower markup, from anywhere between 5 and 8%. Low margins means a retailer makes less money on every unit, but the number of units sold is very high in FMCG. So overall, the amount of money made evens out.The price that the market can bear usually determines the selling price, or in India, the Maximum Retail Price (MRP). Companies work backwards and after accounting for production and marketing costs, arrive at values for the players in the FMCG industry- the transport, distributors and retailers.Strength in the market place also determines the markup and margins allowed. A well-established FMCG company like Hindustan Lever can give less margins to the retailers because the volume of sales of its wide range of products is very high. On the other hand, a new and unknown product and company will need to pay more margins to the retailers to entice them to stock the product in the first place."
